decision	metareview	review1	R1	C1	hedge_score1	sentiment1	review2	R2	C2	hedge_score2	sentiment2	review3	R3	C3	hedge_score3	sentiment3	year
1	The reviewers agreed that the work addresses an important problem. There was disagreement as to the correctness of the arguments in the paper: one of these reviewers was eventually convinced. The other pointed out another two issue in their final post, but it seems that 1. the first is easily adopted and does not affect the correctness of the experiments and 2. the second was fixed in the second revision. Ideally these would be rechecked by the third reviewer, but ultimately the correctness of the work is the authors responsibility. Some related work (by McAllister) was pointed out late in the process. I encourage the authors to take this related work seriously in any revisions. It deserves more than two sentences.	==Main comments The authors connect dropout parameters to a bound of the Rademacher complexity (Rad) of the network. While it is great to see deep learning techniques inspired by learning theory, I think the paper makes too many leaps and the Rad story is ultimately unconvincing. Perhaps it is better to start with the resulting regularizer, and the interesting direct optimization of dropout parameters. In its current form, the following leaps problematic and were not addressed in the paper: 1) Why is is adding Rad as a regularizer reasonable? Rad is usually hard to compute, and most useful for bounding the generalization error. It would be interesting if it also turns out to be a good regularizer, but the authors do not say why nor cite anything. Like the VC dimension, Rad itself depends on the model class, and cannot be directly optimized. Even if you can somehow optimize over the model class, these quantities give very loose bounds, and do not equal to generalization error. For example, I feel even just adding the actual generalization error bound is more natural. Would it make sense to just add Rad to the objective in this way for a linear model? 2) Why is it reasonable to go from a regularizer based on RC to a loose bound of Rad? The actual resulting regularizer turns out to be a weight penalty but this seems to be a rather loose bound that might not have too much to do with Rad anymore. There should be some analysis on how loose this bound is, and if this looseness matter at all. The empirical results themselves seem reasonable, but the results are not actually better than simpler methods in the corresponding tasks, the interpretation is less confident. Afterall, it seems that the proposed method had several parameters that were turned, where the analogous parameters are not present in the competing methods. And the per unit dropout rates are themselves additional parameters, but are they actually good use of parameters? ==Minor comments The optimization is perhaps also not quite right, since this requires taking the gradient of the dropout parameter in the original objective. While the authors point out that one can use the mean, but that is more problematic for the gradient than for normal forward predictions. The gradient used for regular learning is not based on the mean prediction, but rather the samples. tiny columns surrounding figures are ugly and hard to read 	3	3	0.0390243902439024	-0.7357	An important contribution. The paper is well written. Some questions that needs to be better answered are listed here. 1. The theorem is difficult to decipher. Some remarks needs to be included explaining the terms on the right and what they mean with respect to learnability or complexity. 2. How does the regularization term in eq (2) relate to the existing (currently used) norm based regularizers in deep network learning? It may be straight forward but some small simulation/plots explaining this is important. 3. Apart from the accuracy results, the change in computational time for working with eq (2), rather than using existing state-of-the-art deep network optimization needs to be reported? How does this change vary with respect to dataset and network size (beyond the description of scaled regularization in section 4)? 4. Confidence intervals needs to be computed for the retain-rates (reported as a function of epoch). This is critical both to evaluate the stability of regularizers as well as whether the bound from theorem is strong. 5. Did the evaluations show some patterns on the retain rates across different layers? It seems from Figure 3,4 that retain rates in lower layers are more closer to 1 and they decrease to 0.5 as depth increases. Is this a general pattern? 6. It has been long known that dropout relates to non-negative weighted averaging of partially learned neural networks and dropout rate of 0.5 provides best dymanics. The evaluations say that clearly 0.5 for all units/layers us not correct. What does this mean in terms of network architecture? Is it that some layers are easy to average (nothing is learned there, so dropped networks have small variance), while some other layers are sensitive? 7. What are some simple guidelines for choosing the values of p and q? Again it appears p=q=2 is the best, but need confidence intervals here to say anything substantial. 	3	5	0.0222929936305732	0.9947	"This paper studies the adjustment of dropout rates which is a useful tool to prevent the overfitting of deep neural networks. The authors derive a generalization error bound in terms of dropout rates. Based on this, the authors propose a regularization framework to adaptively select dropout rates. Experimental results are also given to verify the theory. Major comments: (1) The Empirical Rademacher complexity is not defined. For completeness, it would be better to define it at least in the appendix. (2) I can not follow the inequality (5). Especially, according to the main text, f^L is a vector-valued function . Therefore, it is not clear to me the meaning of sumsigma_if^L(x_i,w) in (5). (3) I can also not see clearly the third equality in (9). Note that f^l is a vector-valued function. It is not clear to me how it is related to a summation over j there. (4) There is a linear dependency on the number of classes in Theorem 3.1. Is it possible to further improve this dependency? Minor comments: (1) Section 4: 1e-3,1e-4,1e-5 is not consistent with 1e^{-3}, 1e^{-4},1e^{-5} (2) Abstract: there should be a space before ""Experiments"". (3) It would be better to give more details (e.g., page, section) in citing a book in the proof of Theorem 3.1 Summary: The mathematical analysis in the present version is not rigorous. The authors should improve the mathematical analysis. ---------------------------- After Rebuttal: Thank you for revising the paper. I think there are still some possible problems. Let us consider eq (12) in the appendix on the contraction property of Rademacher complexity (RC). (1) Since you consider a variant of RC with absolute value inside the supermum, to my best knowledge, the contraction property (12) should involve an additional factor of 2, see, e.g., Theorem 12 of ""Rademacher and Gaussian Complexities: Risk Bounds and Structural Results"" by Bartlett and Mendelson. Since you need to apply this contraction property L times, there should be a factor of 2^L in the error bound. This make the bound not appealing for neural networks with a moderate L. (2) Second, the function g involves an expectation w.r.t. r before the activation function. I am not sure whether this existence of expectation w.r.t. r would make the contraction property applicable in this case."	3	3	0.0527704485488126	0.8412	2018
1	The reviewers agree that the problem of learning learning credit assignment from terminal rewards is interesting, and that the presented approach is promising. There are some concerns regarding the rigor and correctness of the theoretical results, and I ask the authors to improve those aspects of the paper. I also ask the authors to the result figures easier to read. The chosen colors are not ideal and the use of log-scale x-axis is not standard. Finally, including DAgger in the same plot is confusing assuming that DAgger user more information.	"The authors propose a new episodic reinforcement learning algorithm based on contextual bandit oracles. The key specificity of this algorithm is its ability to deal with the credit assignment problem by learning automatically a progressive ""reward shaping"" (the residual losses) from a feedback that is only provided at the end of the epochs. The paper is dense but well written. The theoretical grounding is a bit thin or hard to follow. The authors provide a few regret theoretical results (that I did not check deeply) obtained by reduction to ""value-aware"" contextual bandits. The experimental section is solid. The method is evaluated on several RL environments against state of the art RL algorithms. It is also evaluated on bandit structured prediction tasks. An interesting synthetic experiment (Figure 4) is also proposed to study the ability of the algorithm to work on both decomposable and non-decomposable structured prediction tasks. Question 1: The credit assignment approach you propose seems way more sophisticated than eligibility traces in TD learning. But sometimes old and simple methods are not that bad. Could you develop a bit on the relation between RESLOPE and eligibility traces ? Question 2: RESLOPE is built upon contextual bandits which require a stationary environment. Does RESLOPE inherit from this assumption? Typos: page 1 ""scalar loss that output."" -> ""scalar loss."" "", effectively a representation"" -> "". By effective we mean effective in term of credit assignment."" page 5 ""and MTR"" -> ""and DR"" page 6 ""in simultaneously."" -> ??? "".In greedy"" -> "". In greedy"" "	3	2	0.0157480314960629	0.9847	"After reading the other reviews and the authors responses, I am satisfied that this paper is above the accept threshold. I think there are many areas of further discussion that the authors can flesh out (as mentioned below and in other reviews), but overall the contribution seems solid. I also appreciate the reviewers efforts to run more experiments and flesh out the discussion in the revised version of the submission. Final concluding thoughts: -- Perhaps pi^ref was somehow better for the structured prediction problems than RL problems? -- Can one show regret bound for multi-deviation if one doesnt have to learn x (i.e., we were given a good x a priori)? --------------------------------------------- ORIGINAL REVIEW First off, I think this paper is potentially above the accept threshold. The ideas presented are interesting and the results are potentially interesting as well. However, I have some reservations, a significant portion of which stem from not understanding aspects of the proposed approach and theoretical results, as outlined below. The algorithm design and theoretical results in the appendix could be made substantially more rigorous. Specifically: -- basic notations such as regret (in Theorem 1), the total reward (J), Q-value (Q), and value function (V) are not defined. While these concepts are fairly standard, it would be highly beneficial to define them formally. -- Im not convinced that the ""terms in the parentheses"" (Eq. 7) are ""exactly the contextual bandit cost"". I would like to see a more rigorous derivation of the connection. For instance, one could imagine that the policy disadvantage should be the difference between the residual costs of the bandit algorithm and the reference policy, rather than just the residual cost of the bandit algorithm. -- Im a little unclear in the proof of Theorem 1 where Q(s,pi_n) from Eq 7 fits into Eq 8. -- The residual cost used for CB.update depends on estimated costs at other time steps h!=h_dev. Presumably, these estimated costs will change as learning progresses. How does one reconcile that? I imagine that it could somehow work out using a bandit algorithm with adversarial guarantees, but I can also imagine it not working out. I would like to see a rigorous treatment of this issue. -- It would be nice to see an end-to-end result that instantiates Theorem 1 (and/or Theorem 2) with a contextual bandit algorithm to see a fully instantiated guarantee. With regards to the algorithm design itself, I have some confusions: -- How does one create x in practice? I believe this is described in Appendix H, but its not obvious. -- What happens if we dont have a good way to generate x and it must be learned as well? Id imagine one would need larger RNNs in that case. -- If x is actually learned on-the-fly, how does that impact the theoretical results? -- I find it curious that theres no notion of future reward learning in the learning algorithm. For instance, in Q learning, one directly models the the long-term (discounted) rewards during learning. In fact, the theoretical analysis talks about advantage functions as well. It would be nice to comment on this aspect at an intuitive level. With regards to the experiments: -- I find it very curious that the results are so negative for using only 1-dev compared to multi-dev (Figure 9 in Appendix). Given that much of the paper is devoted to 1-dev, its a bit disappointing that this issue is not analyzed in more detail, and furthermore the results are mostly hidden in the appendix. -- Its not clear if a reference policy was used in the experiments and what value of beta was used. -- Can the authors speculate about the difference in performance between the RL and bandit structured prediction settings? My personal conjecture is that the bandit structured prediction settings are more easily decomposable additively, which leads to a greater advantage of the proposed approach, but I would like to hear the authors thoughts. Finally, the overall presentation of this paper could be substantially improved. In addition to the above uncertainties, some more points are described below. I dont view these points as ""deal breakers"" for determining accept/reject. -- This paper uses too many examples, from part-of-speech tagging to credit assignment in determining paths. I recommend sticking to one running example, which substantially reduces context switching for the reader. In every such example, there are extraneous details are not relevant to making the point, and the reader needs to spend considerable effort figuring that out for each example used. -- Inconsistent language. For instance, x is sometimes referred to as the ""input example"", ""context"" and ""features"". -- At the end of page 4, ""Internally, ReslopePolicy takes a standard learning to search step."" Two issues: 1) ReslopePolicy is not defined or referred to anywhere else. 2) is the remainder of that paragraph a description of a ""standard learning to search step""? -- As mentioned before, Regret is not defined in Theorem 1 & 2. -- The discussion of the high-level algorithmic concepts is a bit diffuse or lacking. For instance, one key idea in the algorithmic development is that its sufficient to make a uniformly random deviation. Is this idea from the learning to search literature? If so, it would be nice to highlight this in Section 2.2. "	3	5	0.0317100792751981	0.9968	The authors present a new RL algorithm for sparse reward tasks. The work is fairly novel in its approach, combining a learned reward estimator with a contextual bandit algorithm for exploration/exploitation. The paper was mostly clear in its exposition, however some additional information of the motivation for why the said reduction is better than simpler alternatives would help. Pros 1. The results on bandit structured prediction problems are pretty good 2. The idea of a learnt credit assignment function, and using that to separate credit assignment from the exploration/exploitation tradeoff is good. Cons: 1. The method seems fairly more complicated than PPO / A2C, yet those methods seem to perform equally well on the RL problems (Figure 2.). It also seems to be designed only for discrete action spaces. 2. Reslope Boltzmann performs much worse than Reslope Bootstrap, thus having a bag of policies helps. However, in the comparison in Figures 2 and 3, the policy gradient methods dont have the advantage of using a bag of policies. A fairer comparison would be to compare with methods that use ensembles of Q-functions. (like this https://arxiv.org/abs/1706.01502 by Chen et al.). The Q learning methods in general would also have better sample efficiency than the policy gradient methods. 3. The method claims to learn an internal representation of a denser reward function for the sparse reward problem, however the experimental analysis of this is pretty limited (Section 5.3). It would be useful to do a more thorough investigation of whether it learnt a good credit assignment function in the games. One way to do this would be to check the qualitative aspects of the function in a well understood game, like Blackjack. Suggestions: 1. What is the advantage of the method over a simple RL method that predicts a reward at every step (such that the dense rewards add up to match the sparse reward for the episode), and uses this predicted dense reward to perform RL? This, and also a bigger discussion on prior bandit learning methods like LOLS will help under the context for why weâ€™re performing the reduction stated in the paper. Significance: While the method is novel and interesting, the experimental analysis and the explanations in the paper leave it unclear as to whether its significant compared to prior work. Revision: I thank the authors for addressing some of my concerns. The comparison with relative gain of bootstrap wrt ensemble of policies still needs more thorough experimentation, but the approach is novel and as the authors point out, does improve continually with better Contextual Bandit algorithms. I update my review to 6. 	3	4	0.0160919540229885	0.9941	2018
