decision	metareview	review1	R1	C1	hedge_score1	sentiment1	review2	R2	C2	hedge_score2	sentiment2	review3	R3	C3	hedge_score3	sentiment3	year
1	The reviewers are unanimous in accepting the paper. They generally view it as introducing an original approach to online RL using bandit-style selection from a fixed portfolio of off-policy algorithms. Furthermore, rigorous theoretical analysis shows that the algorithm achieves near-optimal performance. The only real knock on the paper is that they use a weak notion of regret i.e. short-sighted pseudo regret. This is considered inevitable, given the setting.	"The authors consider the problem of dynamically choosing between several reinforcement learning algorithms for solving a reinforcement learning with discounted rewards and episodic tasks. The authors propose the following solution to the problem: - During epochs of exponentially increasing size (this technique is well known in the bandit litterature and is called a ""doubling trick""), the various reinforcement learning algorithms are ""frozen"" (i.e. they do not adapt their policy) and the K available algorithms are sampled using the UCB1 algorithm in order to discover the one which yields the highest mean reward. Overall the paper is well written, and presents some interesting novel ideas on aggregating reinforcement learning algorithms. Below are some remarks: - An alternative and perhaps simpler formalization of the problem would be learning with expert advice (using algorithms such as ""follow the perturbed leader""), where each of the available reinforcement learning algorithms acts as an expert. What is more, these algorithms usually yield O(sqrt(T)log(T)), which is the regret obtained by the authors in the worse case (where all the learning algorithms do converge to the optimal policy at the optimal speed O(1/sqrt(T)). It would have been good to see how those approaches perform against the proposed algorithms. - The authors use UCB1, but they did not try KL-UCB, which is stricly better (in fact it is optimal for bounded rewards). In particular the numerical performance of the latter is usually vastly better than the former, especially when rewards have a small variance. - The performance measure used by the authors is rather misleading (""short sighted regret""): they compare what they obtain to what the policy discovered by the best reainforcement learning algorithm underline{based on the trajectories they have seen}, and the trajectories themselves are generated by the choices made by the algorthms at previous time. Ie in general, there might be cases in which one does not explore enough with this approach (i.e one does not try all state-action pairs enough), so that while this performance measure is low, the actual regret is very high and the algorithm does not learn the optimal policy at all (while this could be done by simply exploring at random log(T) times ...). "	3	3	0.0082644628099173	0.9709	"SUMMARY The paper considers a meta-algorithm, in the form of a UCB algorithms, that selects base-learners in a pool of reinforcement learning agents. HIGH LEVEL COMMENTS In this paper, T refers to the total number of meta-decisions. This is very different from the total number of interactions with the system that corresponds to D_T=sum_{tau=1}^T |epsilon_tau|. Wouldnt it make more sense to optimize regret accumulated on this global time? The proposed strategy thus seems a bit naive since different algorithms from the set cal P may generate trajectories of different length. For instance, one algorithm may obtain relatively high rewards very fast with short trajectories and another one may get slightly higher cumulative rewards but on much longer trajectories. In this case, the meta-algorithm will promote the second algorithm, while repeatedly selecting the first one would yield higher cumulative reward in total over all decision (and not meta-decision) time steps. This also means that playing T1 meta-decision steps, where T1>>T, may corresponds to a total number of decision steps sum_{tau=1}^{T_1} |epsilon_tau| still not larger than D_T (where epsilon_tau are other trajectories). Now the performance of a specific learner with T1 trials may be much higher than with T trials, and thus even though the regret of the meta-learner is higher, the overall performance of the recommended policy learned at that point may be better than the one output with T meta-decisions. Thus, it seems to me that a discussion about the total number of decision steps (versus meta-deciion steps) is missing in order to better motivate the choise of performance measure, and generates possibly complicated situations, with a non trivial trade-off that needs to be adressed. This also suggests the proposed algorithm may be quite sub-optimal in terms of total number of decision steps. My feeling is that the reason you do not observe a too bad behavior in practice may be due to the discount factor. OTHER COMMENTS: Page 4: What value of xi do you use in ESBAS ? I guess it should depend on R/(1-gamma)? Page 5: ""one should notice that the first two bounds are obtained by summming up the gaps"": which bounds? which gaps? Can you be more precise? Next sentence also needs to be clarified. What is the budget issue involved here? Can you comment on the main reason why you indeed get O(sqrt{T}) and not O(sqrt{T poly-log(T)}) for instance? Theorem 3: ""with high probability delta_T in O(1/T)"": do you mean with probability higher than 1-delta_T, with delta_T = O(1/T) ? Paragraph on Page 15 : Do you have a proof for the claim that such algorithms indeed satisfy these assumptions ? Especially proving that assumption 3 holds may not be obvious since one may consider an algorithm may better learn using data collected from its played polocy rather than from other policies. (14b-c, 15d): should u be u^alpha ? I may simply be confused with the notations. DECISION Even though there seems to be an important missing discussion regarding optimization of performance with respect to the total number of decision steps rather than the total number of meta-decision steps, I would tend to accept the paper. Indeed, if we left apart the choice for this performance measure, the paper is relatively well written and provides both theoretical and practical results that are of interest. But this has to be clarified. "	3	5	0.0484739676840215	0.9958	The paper considers the problem of online selection of RL algorithms. An algorithm selection (AS) strategy called ESBAS is proposed. It works in a sequence of epochs of doubling length, in the following way: the algorithm selection is based on a UCB strategy, and the parameters of the algorithms are not updated within each epoch (in order that the returns obtained by following an algorithm be iid). This selection allows ESBAS to select a sequence of algorithms within an epoch to generate a return almost as high as the return of the best algorithm, if no learning were made. This weak notion of regret is captured by the short-sighted pseudo regret. Now a bound on the global regret is much harder to obtain because there is no way of comparing, without additional assumption, the performance of a sequence of algorithms to the best algorithm had this one been used to generate all trajectories from the beginning. Here it is assumed that all algorithms learn off-policy. However this is not sufficient, since learning off-policy does not mean that an algorithm is indifferent to the behavior policy that has generated the data. Indeed even for the most basic off-policy algorithms, such as Q-learning, the way data have been collected is extremely important, and collecting transitions using that algorithm (such as epsilon-greedy) is certainly better than following an arbitrary policy (such as uniformly randomly, or following an even poorer policy which would not explore at all). However the authors seem to state an equivalence between learning off-policy and fairness of learning (defined in Assumption 3). For example in their conclusion they mention â€œFairness of algorithm evaluation is granted by the fact that the RL algorithms learn off-policyâ€. This is not correct. I believe the main assumption made in this paper is the Assumption 3 (and not that the algorithms learn off-policy) and this should be dissociated from the off-policy learning. This fairness assumption is very a strong assumption that does not seem to be satisfied by any algorithm that I can think of. Indeed, consider D being the data generated by following algorithm alpha, and let Dâ€™ be the data generated by following algorithm alphaâ€™. Then it makes sense that the performance of algorithm alpha is better when trained on D rather than Dâ€™, and alphaâ€™ is better when trained on Dâ€™ than on D. This contradicts the fairness assumption. This being said, I believe the merit of this paper is to make explicit the actual assumptions required to be able to derive a bound on the global regret. So although the fairness assumption is unrealistic, it has the benefit of existingâ€¦ So in the end I liked the paper because the authors tried to address this difficult problem of algorithmic selection for RL the best way they could. Maybe future work will do better but at least this a first step in an interesting direction. Now, I would have liked a comparison with other algorithms for algorithm selection, like: - explore-then-exploit, where a fraction of T is used to try each algorithm uniformly, then the best one is selected and played for the rest of the rounds. - Algorithms that have been designed for curriculum learning, such as some described in [Graves et al., Automated Curriculum Learning for Neural Networks, 2017], where a proxy for learning progress is used to estimate how much an algorithm can learn from data. Other comments: - Table 1 is really incomprehensible. Even after reading the Appendix B, I had a hard time understanding these results. - I would suggest adding the fairness assumption in the main text and discussing it, as I believe this is crucial component for the understanding of how the global regret can be controlled. - you may want to include references on restless bandits in Section 2.4, as this is very related to AS of RL algorithms (arms follow Markov processes). - The reference [Best arm identification in multi-armed bandits] is missing an author. 	3	4	0.0316742081447963	0.9709	2018
1	This paper compares autoencoder and GAN-based methods for 3D point cloud representation and generation, as well as new (and welcome) metrics for quantitatively evaluating generative models. The experiments form a good but still a bit too incomplete exploration of this topic. More analysis is needed to calibrate the new metrics. Qualitative analysis would be very helpful here to complement and calibrate the quantitative ones. The writing also needs improvement for clarity and verbosity. The author replies and revisions are very helpful, but there is still some way to go on the issues above. Overall, the committee is intersting and recommends this paper for the workshop track.	This paper introduces a generative approach for 3D point clouds. More specifically, two Generative Adversarial approaches are introduced: Raw point cloud GAN, and Latent-space GAN (r-GAN and l-GAN as referred to in the paper). In addition, a GMM sampling + GAN decoder approach to generation is also among the experimented variations. The results look convincing for the generation experiments in the paper, both from class-specific (Figure 1) and multi-class generators (Figure 6). The quantitative results also support the visuals. One question that arises is whether the point cloud approaches to generation is any more valuable compared to voxel-grid based approaches. Especially Octree based approaches [1-below] show very convincing and high-resolution shape generation results, whereas the details seem to be washed out for the point cloud results presented in this paper. I would like to see comparison experiments with voxel based approaches in the next update for the paper. [1] @article{tatarchenko2017octree, title={Octree Generating Networks: Efficient Convolutional Architectures for High-resolution 3D Outputs}, author={Tatarchenko, Maxim and Dosovitskiy, Alexey and Brox, Thomas}, journal={arXiv preprint arXiv:1703.09438}, year={2017} } In light of the authors octree updates score is updated. I expect these updates to be reflected in the final version of the paper itself as well. 	3	5	0.0248756218905472	0.9371	3D data processing is very important topic nowadays, since it has a lot of applications: robotics, AR/VR, etc. Current approaches to 2D image processing based on Deep Neural Networks provide very accurate results and a wide variety of different architectures for image modelling, generation, classification, retrieval. The lack of DL architectures for 3D data is due to complexity of representation of 3D data, especially when using 3D point clouds. Considered paper is one of the first approaches to learn GAN-type generative models. Using PointNet architecture and latent-space GAN, the authors obtained rather accurate generative model. The paper is well written, results of experiments are convincing, the authors provided the code on the github, realizing their architectures. Thus I think that the paper should be published.	4	5	0.024	0.5563	"Summary: This paper proposes generative models for point clouds. First, they train an auto-encoder for 3D point clouds, somewhat similar to PointNet (by Qi et al.). Then, they train generative models over the auto-encoders latent space, both using a ""latent-space GAN"" (l-GAN) that outputs latent codes, and a Gaussian Mixture Model. To generate point clouds, they sample a latent code and pass it to the decoder. They also introduce a ""raw point cloud GAN"" (r-GAN) that, instead of generating a latent code, directly produces a point cloud. They evaluate the methods on several metrics. First, they show that the autoencoders latent space is a good representation for classification problems, using the ModelNet dataset. Second, they evaluate the generative model on several metrics (such as Jensen-Shannon Divergence) and study the benefits and drawbacks of these metrics, and suggest that one-to-one mapping metrics such as earth movers distance are desirable over Chamfer distance. Methods such as the r-GAN score well on the latter by over-representing parts of an object that are likely to be filled. Pros: - It is interesting that the latent space models are most successful, including the relatively simple GMM-based model. Is there a reason that these models have not been as successful in other domains? - The comparison of the evaluation metrics could be useful for future work on evaluating point cloud GANs. Due to the simplicity of the method, this paper could be a useful baseline for future work. - The part-editing and shape analogies results are interesting, and it would be nice to see these expanded in the main paper. Cons: - How does a model that simply memorizes (and randomly samples) the training set compare to the auto-encoder-based models on the proposed metrics? How does the diversity of these two models differ? - The paper simultaneously proposes methods for generating point clouds, and for evaluating them. The paper could therefore be improved by expanding the section comparing to prior, voxel-based 3D methods, particularly in terms of the diversity of the outputs. Although the performance on automated metrics is encouraging, it is hard to conclude much about under what circumstances one representation or model is better than another. - The technical approach is not particularly novel. The auto-encoder performs fairly well, but it is just a series of MLP layers that output a Nx3 matrix representing the point cloud, trained to optimize EMD or Chamfer distance. The most successful generative models are based on sampling values in the auto-encoders latent space using simple models (a two-layer MLP or a GMM). - While it is interesting that the latent space models seem to outperform the r-GAN, this may be due to the relatively poor performance of r-GAN than to good performance of the latent space models, and directly training a GAN on point clouds remains an important problem. - The paper could possibly be clearer by integrating more of the ""background"" section into later sections. Some of the GAN figures could also benefit from having captions. Overall, I think that this paper could serve as a useful baseline for generating point clouds, but I am not sure that the contribution is significant enough for acceptance. "	2	4	0.0207939508506616	0.9929	2018
0	"In principle, the idea behind the submission is sound: use a generative model (GANs in this case) to learn to generate desirable ""goals"" (subsets of the state space) and use that instead of uniform sampling for goals. Overall I tend to agree with Reviewer 3 in that the current set of results is not convincing in terms of it being able to generate goals in a high-dimensional state space, which seems to be be whole raison detre of GANs in this proposed method. The coverage experiment in Figure 5 seems like a good *illustration* of the method, but for this work to be convincing, I think we would need a more diverse set of experiments (a la Figure 2) showing how this method performs on complicated tasks. I encourage the authors to sharpen the definitions, as suggested by reviewers, and, if possible, provide experiments where the Assumptions being made in Section 3.3 are *violated* somehow (to actually test how the method fails in those cases)."	"In general I find this to be a good paper and vote for acceptance. The paper is well-written and easy to follow. The proposed approach is a useful addition to existing literature. Besides that I have not much to say except one point I would like to discuss: In 4.2 I am not fully convinced of using an adversial model for goal generation. RL algorithms generally suffer from poor stability and GANs themselves can have convergence issues. This imposes another layer of possible instability. Besides, generating useful reward function, while not trivial, can be seen as easier than solving the full RL problem. Can the authors argue why this model class was chosen over other, more simple, generative models? Furthermore, did the authors do experiments with simpler models? Related: ""We found that the LSGAN works better than other forms of GAN for our problem."" Was this improvement minor, or major, or didnt even work with other GAN types? This question is important, because for me the big question is if this model is universal and stable in a lot of applications or requires careful fine-tuning and monitoring. --- Update: The authors addressed the major point of criticism in my review. I am now more convinced in the quality of the proposed work, and have updated my review score accordingly."	4	4	0.0410958904109589	0.9491	This paper proposed a method for automatic curriculum generation that allow an agent to learn to reach multiple goals in an environment with considerable sample efficiency. They use a generator network to propose tasks for the agent accomplish. The generator network is trained with GAN. In addition, the proposed method is also shown to be able to solve tasks with sparse rewards without the need manually modify reward functions. They compare the Goal GAN method with four baselines, including Uniform sampling, Asymmetric Self-play, SAGG-RIAC, and Rejection sampling. The proposed method is tested on two environments: Free Ant and Maze Ant. The empirical study shows that the proposed method is able to improve policiesâ€™ training efficiency comparing to these baselines. The technical contributions seem sound, however I find it is slightly difficult to fully digest the whole paper without getting the insight from each individual piece and there are some important details missing, as I will elaborate more below. 1. it is unclear to me why the proposed method is able to solve tasks with sparse rewards? Is it because of the horizons of the problems considered are not long enough? The author should provide more insight for this contribution. 2. It is unclear to me how R_min and R_max as hyperparameters are obtained and how their settings affect the performance. 3. Another concern I have is regarding the generalizability of the proposed method. One of the assumption is â€œA policy trained on a sufficient number of goals in some area of the goal-space will learn to interpolate to other goals within that areaâ€. This seems to mean that the area is convex. It might be better if some quantitative analysis can be provided to illustrate geometry of goal space (given complex motor coordination) that is feasible for the proposed method. 4. It is difficult to understand the plots in Figure 4 without more details. Do you assume for every episode, the agent starts from the same state? 5. For the plots in Figure 2, is there any explanation for the large variance for Goal GAN? Given that the state space is continuous, 10 runs seems not enough. 6. According to the experimental details, three rollouts are performed to estimate the empirical return. It there any justification why three rollouts are enough? 7. Minor comments Achieve tasks -> achieve goals or accomplish/solve tasks A variation of to -> variation of Allows a policy to quickly learn to reach â€¦-> allow an agent to be quickly learn a policy to reachâ€¦ â€¦the difficulty of the generated goals -> â€¦ the difficulty of reaching 	3	4	0.0185185185185185	0.9489	"Summary: This paper proposes to use a GAN to generate goals to implement a form of curriculum learning. A goal is defined as a subset of the state space. The authors claim that this model can discover all ""goals"" in the environment and their difficulty, which can be measured by the success rate / reward of the policy. Hence the goal network could learn a form of curriculum, where a goal is good if it is a state that the policy can reach after a (small) improvement of the current policy. Training the goal GAN is done via labels, which are states together with the achieved reward by the policy that is being learned. The benchmark problems are whether the GAN generates goals that allow the agent to reach the end of a U-maze, and a point-mass task. Authors compare GAN goal generation vs uniformly choosing a goal and 2 other methods. My overall impression is that this work addresses an interesting question, but the experimental setup / results are not clearly worked out. More broadly, the paper does not address how one can combine RL and training a goal GAN in a stable way. Pro: - Developing hierarchical learning methods to improve the sample complexity of RL is an important problem. - The paper shows that the U-maze can be solved using a variety of methods that generate goals in a non-uniform way. Con: - It is not clear to me how the asymmetric self-play and SAGG-RIAC are implemented and why they are natural baselines. - It is not clear to me what the goals are in the point mass experiment. This entire experiment should be explained much more clearly (+image). - It is not clear how this method compares qualitatively vs baselines (differences in goals etc). - This method doesnt seem to always outperform the asymm-selfplay baseline. The text mentions that baseline is less efficient, but this doesnt make the graph very interpretable. - The curriculum in the maze-case consists of regions that just progress along the maze, and hence is a 1-dimensional space. Hence using a manually defined set of goals should work quite well. It would be better to include such a baseline as well. - The experimental maze-setting and point-mass have a simple state / goal structure. How can this method generalize to harder problems? -- The entire method is quite complicated (e.g. training GANs can be highly unstable). How do we stabilize / balance training the GAN vs the RL problem? -- I dont see how this method could generalize to problems where the goals / subregions of space do not have a simple distribution as in the maze problem, e.g. if there are multiple ways of navigating a maze towards some final goal state. In that case, to discover a good solution, the generated goals should focus on one alternative and hence the GAN should have a unimodal distribution. How do you force the GAN in a principled way to focus on one goal in this case? How could you combine RL and training the GAN stably in that case? Detailed: - (2) is a bit strange: shouldnt the indicator say: 1( exists t: s_t in S^g )? Surely not all states in the rollout (s_0 ... s_t) are in the goal subspace: the indicator does not factorize over the union. Same for other formulas that use union. - Are goals overlapping or non-overlapping subsets of the state space? Definition around (1) basically says its non-overlapping, yet the goal GAN seems to predict goals in a 2d space, hence the predicted goals are overlapping? - What are the goals that the non-uniform baselines predict? Does the GAN produce better goals? - Generating goal labels is - Paper should discuss literature on hierarchical methods that use goals learned from data and via variational methods: 1. Strategic Attentive Writer (STRAW), V. Mnih et al, NIPS 2016 2. Generating Long-term Trajectories Using Deep Hierarchical Networks. S. Zheng et al, NIPS 2016"	2	4	0.0451127819548872	0.9734	2018
