decision	metareview	review1	R1	C1	hedge_score1	sentiment1	review2	R2	C2	hedge_score2	sentiment2	review3	R3	C3	hedge_score3	sentiment3	year
1	This paper incorporates attention in the PixelCNN model and shows how to use MAML to enable few-shot density estimation. The paper received mixed reviews (7,6,4). After rebuttal the first reviewer updated the score to accept. The AC shares the concern of novelty with the first reviewer. However, it is also not trivial to incorporate attention and MAML in PixelCNN, thus the AC decided to accept the paper. 	"This paper focuses on few shot learning with autoregressive density estimation. Specifically, the paper improves PixelCNN with 1) neural attention, 2) meta learning techniques, and shows that the model achieve STOA few showt density estimation on the Omniglot dataset and demonstrate the few showt image generation on the Stanford Online Products dataset. The model is interesting, however, several details are not clear, which makes it harder to repeat the model and the experimental results. For example, what is the reason to use the (key, value) pair to encode these support images, what does the ""key"" means and what is the difference between ""keys"" and ""values""? In the experiments, the author did not explain the meaning of ""nats/dim"" and how to compute it. Another question is about the repetition of the experimental results. We know that PixelCNN is already a quite complicated model, it would be even harder to implement the proposed model. I wonder whether the author will release the official code to public to help the community?"	3	4	0.0357142857142857	0.8433	"This paper considers the problem of one/few-shot density estimation, using metalearning techniques that have been applied to one/few-shot supervised learning. The application is an obvious target for research and some relevant citations are missing, e.g. ""Towards a Neural Statistician"" (Edwards et al., ICLR 2017). Nonetheless, I think the current paper seems interesting enough to merit publication. The paper is well-produced, i.e. the overall writing, visuals, and narrative flow are good. It was easy to read the paper straight through while understanding both the technical details and more intuitive motivations. I have some concerns about the architectures and experiments presented in the paper. For architectures: the attention-based model seems powerful but difficult to scale to problems with more inputs for conditioning, and the meta PixelCNN model is a standard PixelCNN trained with the MAML approach by Finn et al. For experiments: the ImageNet flipping task is clearly tailored to the strengths of the attention-based model, and the presentation of the general Omniglot results could be improved. The image flipping experiment is neat, but the attention-based models strong performance is unsurprising. I think the results in Tables 1/2 should be merged into a single table. It would make it clear that the MAML-based and attention-based models achieve similar performance on this task. Overall, I think the paper makes a nice contribution. The paper could be improved significantly, e.g., by showing how to scale the attention-based architecture to problems with more data or by designing an architecture specifically for use with MAML-based inference."	3	4	0.0279999999999999	0.9817	"This paper focuses on the density estimation when the amount of data available for training is low. The main idea is that a meta-learning model must be learnt, which learns to generate novel density distributions by learn to adapt a basic model on few new samples. The paper presents two independent method. The first method is effectively a PixelCNN combined with an attention module. Specifically, the support set is convolved to generate two sets of feature maps, the so called ""key"" and the ""value"" feature maps. The key feature map is used from the model to compute the attention in particular regions in the support images to generate the pixels for the new ""target"" image. The value feature maps are used to copmpute the local encoding, which is used to generate the respective pixels for the new target image, taking into account also the attention values. The second method is simpler, and very similar to fine-tuning the basis network on the few new samples provided during training. Despite some interesting elements, the paper has problems. First, the novelty is rather limited. The first method seems to be slightly more novel, although it is unclear whether the contribution by combining different models is significant. The second method is too similar to fine-tuning: although the authors claim that mathcal{L}_inner can be any function that minimizes the total loss mathcal{L}, in the end it is clear that the log-likelihood is used. How is this approach (much) different from standard fine-tuning, since the quantity P(x; theta) is anyways unknown and cannot be ""trained"" to be maximized. Besides the limited novelty, the submission leaves several parts unclear. First, why are the convolutional features of the support set in the first methods divided into ""key"" and ""value"" feature maps as in p_key=p[:, 0:P], p_value=p[:, P:2*P]? Is this division arbitrary, or is there a more basic reason? Also, is there any different between key and value? Why not use the same feature map for computing the attention and computing eq (7)? Also, in the first model it is suggested that an additional feature can be having a 1-of-K channel for the supporting image label: the reason is that you might have multiple views of objects, and knowing which view contributes to the attention can help learning the density. However, this assumes that the views are ordered, namely that the recording stage has a very particular format. Isnt this a bit unrealistic, given the proposed setup anyways? Regarding the second method, it is not clear why leaving this room for flexibility (by allowing L_inner to be any function) to the model is a good idea. Isnt this effectively opening the doors to massive overfitting? Besides, isnt the statement that the function mathcal{L}_inner void? At the end of the day one can also claim the same for gradient descent: you dont need to have the true gradients of the true loss, as long as the objective function obtains gradually lower and lower values? Last, it is unclear what is the connection between the first and the second model. Are these two independent models that solve the same problem? Or are they connected? Regarding the evaluation of the models, the nature of the task makes the evaluation hard: for real data like images one cannot know the true distribution of particular support examples. Surrogate tasks are explored, first image flipping, then likelihood estimation of Omniglot characters, then image generation. Image flipping does not sound a very relevant task to density estimation, given that the task is deterministic. Perhaps, what would make more sense would be to generate a new image given that the support set has images of a particular orientation, meaning that the model must learn how to learn densities from arbitrary rotations. Regarding Omniglot character generation, the surrogate task of computing likelihood of known samples gives a bit better, however, this is to be expected when combining a model without attention, with an attention module. All in all, the paper has some interesting ideas. I encourage the authors to work more on their submission and think of a better evaluation and resubmit. "	3	5	0.0204379562043795	0.9925	2018
1	All reviewers agree that the proposed method is novel and experiments do a good job in establishing its value for few-shot learning. Most the concerns raised by the reviewers on experimental protocols have been addressed in the author response and revised version.	This paper introduces a graph neural net approach to few-shot learning. Input examples form the nodes of the graph and edge weights are computed as a nonlinear function of the absolute difference between node features. In addition to standard supervised few-shot classification, both semi-supervised and active learning task variants are introduced. The proposed approach captures several popular few-shot learning approaches as special cases. Experiments are conducted on both Omniglot and miniImagenet datasets. Strengths - Use of graph neural nets for few-shot learning is novel. - Introduces novel semi-supervised and active learning variants of few-shot classification. Weaknesses - Improvement in accuracy is small relative to previous work. - Writing seems to be rushed. The originality of applying graph neural networks to the problem of few-shot learning and proposing semi-supervised and active learning variants of the task are the primary strengths of this paper. Graph neural nets seem to be a more natural way of representing sets of items, as opposed to previous approaches that rely on a random ordering of the labeled set, such as the FCE variant of Matching Networks or TCML. Others will likely leverage graph neural net ideas to further tackle few-shot learning problems in the future, and this paper represents a first step in that direction. Regarding the graph, I am wondering if the authors can comment on what scenarios is the graph structure expected to help? In the case of 1-shot, the graph can only propagate information about other classes, which seems to not be very useful. Though novel, the motivation behind the semi-supervised and active learning setup could use some elaboration. By including unlabeled examples in an episode, it is already known that they belong to one of the K classes. How realistic is this set-up and in what application is it expected that this will show up? For active learning, the proposed method seems to be specific to the case of obtaining a single label. How can the proposed method be scaled to handle multiple requested labels? Overall the paper is well-structured and related work covers the relevant papers, but the details of the paper seem hastily written. In the problem set-up section, it is not immediately clear what the distinction between s, r, and t is. Stating more explicitly that s is for the labeled data, etc. would make this section easier to follow. In addition, I would suggest stating the reason why t=1 is a necessary assumption for the proposed model in the few-shot and semi-supervised cases. Regarding the Omniglot dataset, Vinyals et al. (2016) augmented the classes so that 4,800 classes were used for training and 1,692 for test. Was the same procedure done for the experiments in the paper? If yes, please update 6.1.1 to make this distinction more clear. If not, please update the experiments to be consistent with the baselines. In the experiments, does the varphi MLP explicitly enforce symmetry and identity or is it learned? Regarding the Omniglot baselines, it appears that Koch et al. (2015), Edwards & Storkey (2016), and Finn et al. (2017) use non-standard class splits relative to the other methods. This should probably be noted. The results for Prototypical Networks appear to be incorrect in the Omniglot and Mini-Imagenet tables. According to Snell et al. (2017) they should be 49.4% and 68.2% for miniImagenet. Moreover, Snell et al. (2017) only used 64 classes for training instead of 80 as utilized in the proposed approach. Given this, I am wondering if the authors can comment on the performance difference in the 5-shot case, even though Prototypical Networks is a special case of GNNs? For semi-supervised and active-learning results, please include error bars for the miniImagenet results. Also, it would be interesting to see 20-way results for Omniglot as the gap between the proposed method and the baseline would potentially be wider. Other Comments: - In Section 4.2, Gc(.) is defined in Equation 2 but not mentioned in the text. - In Section 4.3, adding an equation to clarify the relationship with Matching Networks would be helpful. - I believe there is a typo in section 4.3 in that softmax(varphi) should be softmax(-varphi), so that more similar pairs will be more heavily weighted. - The equation in 5.1 appears to be missing a minus sign. Overall, the paper is novel and interesting, though the clarity and experimental results could be better explained. EDIT: I have read the authors response. The writing is improved and my concerns have largely been addressed. I am therefore revising my rating of the paper to a 7.	3	4	0.035667107001321	0.9929	This paper proposes to use graph neural networks for the purpose of few-shot learning, as well as semi-supervised learning and active learning. The paper first relies on convolutional neural networks to extract image features. Then, these image features are organized in a fully connected graph. Then, this graph is processed with an graph neural network framework that relies on modelling the differences between features maps, propto phi(abs(x_i-x_j)). For few-shot classification then the cross-entropy classification loss is used on the node. The paper has some interesting contributions and ideas, mainly from the point of view of applications, since the basic components (convnets, graph neural networks) are roughly similar to what is already proposed. However, the novelty is hurt by the lack of clarity with respect to the model design. First, as explained in 5.1 a fully connected graph is used (although in Fig. 2 the graph nodes do not have connections to all other nodes). If all nodes are connected to all nodes, what is the different of this model from a fully connected, multi-stream networks composed of S^2 branches? To rephrase, what is the benefit of having a graph structure when all nodes are connected with all nodes. Besides, what is the effect when having more and more support images? Is the generalization hurt? Second, it is not clear whether the label used as input in eq. (4) is a model choice or a model requirement. The reason is that the label already appears in the loss of the nodes in 5.1. Isnt using the label also as input redundant? Third, the paper is rather vague or imprecise at points. In eq. (1) many of the notations remain rather unclear until later in the text (and even then they are not entirely clear). For instance, what is s, r, t. The experimental section is also ok, although not perfect. The proposed method appears to have a modest improvement for few-shot learning. However, in the case of active learning and semi-supervised learning the method is not compared to any baselines (other than the random one), which makes conclusions hard to reach. In general, I tend to be in favor of accepting the paper if the authors have persuasive answers and provide the clarifications required.	3	4	0.0294906166219839	0.9029	This paper studies the problem of one-shot and few-shot learning using the Graph Neural Network (GNN) architecture that has been proposed and simplified by several authors. The data points form the nodes of the graph with the edge weights being learned, using ideas similar to message passing algorithms similar to Kearnes et al and Gilmer et al. This method generalizes several existing approaches for few-shot learning including Siamese networks, Prototypical networks and Matching networks. The authors also conduct experiments on the Omniglot and mini-Imagenet data sets, improving on the state of the art. There are a few typos and the presentation of the paper could be improved and polished more. I would also encourage the authors to compare their work to other unrelated approaches such as Attentive Recurrent Comparators of Shyam et al, and the Learning to Remember Rare Events approach of Kaiser et al, both of which achieve comparable performance on Omniglot. I would also be interested in seeing whether the approach of the authors can be used to improve real world translation tasks such as GNMT. 	3	4	0.0111731843575419	0.9074	2018
1	This paper introduces a student-teacher method for learning from labels of varying quality (i.e. varying fidelity data). This is an interesting idea which shows promising results. Some further connections to various kinds of semi-supervised and multi-fidelity learning would strengthen the paper, although understandably it is not easy to cover the vast literature, which also spans different scientific domains. One reviewer had a concern about some design decisions that seemed ad-hoc, but at least the authors have intuitively and experimentally justified them.	"The problem of interest is to train deep neural network models with few labelled training samples. The specific assumption is there is a large pool of unlabelled data, and a heuristic function that can provide label annotations, possibly with varying levels of noises, to those unlabelled data. The adopted learning model is of a student/teacher framework as in privileged learning/knowledge distillation/model compression, and also machine teaching. The student (deep neural network) model will learn from both labelled and unlabelled training data with the labels provided by the teacher (Gaussian process) model. The teacher also supplies an uncertainty estimate to each predicted label. How about the heuristic function? This is used for learning initial feature representation of the student model. Crucially, the teacher model will also rely on these learned features. Labelled data and unlabelled data are therefore lie in the same dimensional space. Specific questions to be addressed: 1)	Clustering of strongly-labelled data points. Thinking about the statement â€œeach an expert on this specific region of data spaceâ€, if this is the case, I am expecting a clustering for both strongly-labelled data points and weakly-labelled data points. Each teacher model is trained on a portion of strongly-labelled data, and will only predict similar weakly-labelled data. On a related remark, the nice side-effect is not right as it was emphasized that data points with a high-quality label will be limited. As well, GP models, are quite scalable nowadays (experiments with millions to billions of data points are available in recent NIPS/ICML papers, though, they are all rely on low dimensionality of the feature space for optimizing the inducing point locations). It will be informative to provide results with a single GP model. 2)	From modifying learning rates to weighting samples. Rather than using uncertainty in label annotation as a multiplicative factor in the learning rate, it is more â€œintuitiveâ€ to use it to modify the sampling procedure of mini-batches (akin to baseline #4); sample with higher probability data points with higher certainty. Here, experimental comparison with, for example, an SVM model that takes into account instance weighting will be informative, and a student model trained with logits (as in knowledge distillation/model compression). "	2	4	0.0083333333333333	0.6486	"This paper suggests a simple yet effective approach for learning with weak supervision. This learning scenario involves two datasets, one with clean data (i.e., labeled by the true function) and one with noisy data, collected using a weak source of supervision. The suggested approach assumes a teacher and student networks, and builds the final representation incrementally, by taking into account the ""fidelity"" of the weak label when training the student at the final step. The fidelity score is given by the teacher, after being trained over the clean data, and its used to build a cost-sensitive loss function for the students. The suggested method seems to work well on several document classification tasks. Overall, I liked the paper. I would like the authors to consider the following questions - - Over the last 10 years or so, many different frameworks for learning with weak supervision were suggested (e.g., indirect supervision, distant supervision, response-based, constraint-based, to name a few). First, Id suggest acknowledging these works and discussing the differences to your work. Second - Is your approach applicable to these frameworks? It would be an interesting to compare to one of those methods (e.g., distant supervision for relation extraction using a knowledge base), and see if by incorporating fidelity score, results improve. - Can this approach be applied to semi-supervised learning? Is there a reason to assume the fidelity scores computed by the teacher would not improve the student in a self-training framework? - The paper emphasizes that the teacher uses the students initial representation, when trained over the clean data. Is it clear that this step in needed? Can you add an additional variant of your framework when the fidelity score are computed by the teacher when trained from scratch? using different architecture than the student? - I went over the authors comments and I appreciate their efforts to help clarify the issues raised."	3	4	0.0286624203821656	0.9693	"The authors propose an approach for training deep learning models for situation where there is not enough reliable annotated data. This algorithm can be useful because correct annotation of enough cases to train a deep model in many domains is not affordable. The authors propose to combine a huge number of weakly annotated data with a small set of strongly annotated cases to train a model in a student-teacher framework. The authors evaluate their proposed methods on one toy problem and two real-world problems. The paper is well written, easy to follow, and have good experimental study. My main problem with the paper is the lack of enough motivation and justification for the proposed method; the methodology seems pretty ad-hoc to me and there is a need for more experimental study to show how the methodology work. Here are some questions that comes to my mind: (1) Why first building a student model only using the weak data and why not all the data together to train the student model? To me, it seems that the algorithm first tries to learn a good representation for which lots of data is needed and the weak training data can be useful but why not combing with the strong data? (2) What are the sensitivity of the procedure to how weakly the weak data are annotated (this could be studied using both toy example and real-world examples)? (3) The authors explicitly suggest using an unsupervised method (check Baseline no.1) to annotate data weakly? Why not learning the representation using an unsupervised learning method (unsupervised pre training)? This should be at least one of the baselines. (4) the idea of using surrogate labels to learn representation is also not new. One example work is ""Discriminative Unsupervised Feature Learning with Exemplar Convolutional Neural Networks"". The authors didnt compare their method with this one."	3	3	0.0357142857142857	-0.6497	2018
