decision	metareview	review1	R1	C1	hedge_score1	sentiment1	review2	R2	C2	hedge_score2	sentiment2	review3	R3	C3	hedge_score3	sentiment3	year
1	Thank you for submitting you paper to ICLR. This paper was enhanced noticeably in the rebuttal period and two of the reviewers improved their score as a result. There is a good range of experimental work on a number of different tasks. The addition of the comparison with Liu & Feng, 2016 to the appendix was sensible. Please make sure that the general conclusions drawn from this are explained in the main text and also the differences to Tran et al., 2017 (i.e. that the original model can also be implicit in this case).	Thank you for the feedback, and I think many of my concerns have been addressed. I think the paper should be accepted. ==== original review ==== Thank you for an interesting read. Approximate inference with implicit distribution has been a recent focus of the research since late 2016. I have seen several papers simultaneously proposing the density ratio estimation idea using GAN approach. This paper, although still doing density ratio estimation, uses kernel estimators instead and thus avoids the usage of discriminators. Furthermore, the paper proposed a new type of implicit posterior approximation which uses intuitions from matrix factorisation. I do think that another big challenge that we need to address is the construction of good implicit approximations, which is not well studied in previous literature (although this is a very new topic). This paper provides a good start in this direction. However several points need to be clarified and improved: 1. There are other ways to do implicit posterior inference such as amortising deterministic/stochastic dynamics, and approximating the gradient updates of VI. Please check the literature. 2. For kernel based density ratio estimation methods, you probably need to cite a bunch of Sugiyama papers besides (Kanamori et al. 2009). 3. Why do you need to introduce both regression under p and q (the reverse ratio trick)? I didnt see if you have comparisons between the two. From my perspective the reverse ratio trick version is naturally more suitable to VI. 4. Do you have any speed and numerical issues on differentiating through alpha (which requires differentiating K^{-1})? 5. For kernel methods, kernel parameters and lambda are key to performances. How did you tune them? 6. For the celebA part, can you compute some quantitative metric, e.g inception score? 	3	4	0.0241379310344827	0.968	"This paper presents Kernel Implicit Variational Inference (KIVI), a novel class of implicit variational distributions. KIVI relies on a kernel approximation to directly estimate the density ratio. Importantly, the optimal kernel approximation in KIVI has closed-form solution, which allows for faster training since it avoids gradient ascent steps that may soon get ""outdated"" as the optimization over the variational distribution runs. The paper presents experiments on a variety of scenarios to show the performance of KIVI. Up to my knowledge, the idea of estimating the density ratio using kernels is novel. I found it interesting, specially since there is a closed-form solution for this estimate. The closed form solution involves a matrix inversion, but this shouldnt be an issue, as the matrix size is controlled by the number of samples, which is a parameter that the practitioner can choose. I also found interesting the implicit MMNN architecture proposed in Section 4. The experiments seem convincing too, although I believe the paper could probably be improved by comparing with other implicit VI methods, such as [Liu & Feng], [Tran et al.], or others. My major criticism with the paper is the quality of the writing. I found quite a few errors in every page, which significantly affects readability. I strongly encourage the authors to carefully review the entire paper and search for typos, grammatical errors, unclear sentences, etc. Please find below some further comments broken down by section. Section 1: In the introduction, it is unclear to me what ""protect these models"" means. Also, in the second paragraph, the authors talk about ""often leads to biased inference"". The concept to ""biased inference"" is unclear. Finally, the sentence ""the variational posterior we get in this way does not admit a tractable likelihood"" makes no sense to me; how can a posterior admit (or not admit) a likelihood? Section 3: The first paragraph of the KIVI section is also unclear to me. In Section 3.1, it looks like the cost function L(hat(r)) is different from the loss in Eq. 1, so it should have a different notation. In Eq. 4, I found it confusing whether L(r)=J(r). Also, it would be nice to include a brief description of why the expectation in Eq. 4 is taken w.r.t. p(z) instead of q(z), for those readers who are less familiar with [Kanamori et al.]. Finally, the motivation behind the ""reverse ratio trick"" was unclear to me (the trick is clear, but I didnt fully understand why its needed). Section 4: The first paragraph of the example can be improved with a brief discussion of why the methods of [Mescheder et al.] and [Song et al.] ""are nor applicable"". Also, the paragraph above Eq. 11 (""When modeling a matrix..."") was unclear to me. Section 6: In Figure 1(a), I think there must be something wrong, because it is well-known that VI tends to cover one of the modes of the posterior only due to the form of the KL divergence (in contrast to EP, which should look like the curve in the figure). Additionally, Figure 3(a) (and the explanation in the text) was unclear to me. Finally, I disagree with the discussion regarding overfitting in Figure 3(b): that plot doesnt show overfitting because it is a plot of the training loss (and overfitting occurs on test); instead it looks like an optimization issue that makes the bound decrease. **** EDITS AFTER AUTHORS REBUTTAL **** I increased the rating to 7 after reading the revised version. "	3	3	0.0328151986183074	0.8732	Update: I read the other reviews and the authors rebuttal. Thanks to the authors for clarifying some details. Im still against the paper being accepted. But I dont have a strong opinion and will not argue against so if other reviewers are willing. ------ The authors propose Kernel Implicit VI, an algorithm allowing implicit distributions as the posterior approximation by employing kernel ridge regression to estimate a density ratio. Unlike current approaches with adversarial training, the authors argue this avoids the problems of noisy ratio estimation, as well as potentially high-dimensional inputs to the discriminator. The work has interesting ideas. Unfortunately, Im not convinced that the method overcomes these difficulties as they argue in Sec 3.2. An obvious difficulty with kernel ridge regression in practice is that its complete inaccuracy to estimate high-dimensional density ratios. This is especially the case given a limited number of samples from both p and q (which is the same problem as previous methods) as well as the RBF kernel. While the RBF kernel still takes the same high-dimensional inputs and does not involve learning massive sets of parameters, it also does not scale well at all for accurate estimation. This is the same problem as related approaches with Stein variational gradient descent; namely, it avoids minimax problems as in adversarial training by implicitly integrating over the discriminator function space using the kernel trick. This flaw has rather deep implications. For example, my understanding of the implicit VI on the Bayesian neural network in Sec 4 is that it ends up as cross-entropy minimization subject to a poorly estimated KL regularizer. Id like to see just how much entropy the implicit approximation has instead of concnetrating toward a point; or more directly, what the implicit posterior approximation looks like compared to a true posterior inferred by, say, HMC as the ground truth. This approach also faces difficulties that the naive Gaussian approximation applied to Bayesian neural nets does not: implicit approximations cannot exploit the local reparameterization trick and are therefore limited to specific architectures that does not involve sampling very large weight matrices. The authors report variational lower bounds, which Im not sure is really a lower bound. Namely, the bias incurred by the ratio estimation makes it difficult to compare numbers. An obvious but very illustrative experiment Id like to see would be the accuracy of the KL estimator on problems where we can compute it tractably, or where we can Monte Carlo estimate it very well under complicated but tractable densities. I also suggest the authors perform the experiment suggested above with HMC as ground truth on a non-toy problem such as a fairly large Bayesian neural net.	2	4	0.0202247191011235	-0.7804	2018
0	The paper provides a constrained mutual information objective function whose Lagrangian dual covers several existing generative models. However reviewers are not convinced of the significance or usefulness of the proposed unifying framework (at least from the way results are presented currently in the paper). Authors have not taken any steps towards revising the paper to address these concerns. Improving the presentation to bring out the significance/utility of the proposed unifying framework is needed.	"Update after rebuttal ========== Thanks for your response on my questions. The stated usefulness of the method unfortunately do not answer my worry about the significance. It remains unclear to me how much ""real"" difference the presented results would make to advance the existing work on generative models. Also, the authors did not promised any major changes in the final version in this direction, which is why I have reduced my score. I do believe that this work could be useful and should be resubmitted. There are two main things to improve. First, the paper need more work on improving the clarity. Second, more work needs to be added to show that the paper will make a real difference to advance/improve existing methods. ========== Before rebuttal ========== This paper proposes an optimization problem whose Lagrangian duals contain many existing objective functions for generative models. Using this framework, the paper tries to generalize the optimization problems by defining computationally-tractable family which can be expressed in terms of existing objective functions. The paper has interesting elements and the results are original. The main issue is that the significance is unclear. The writing in Section 3 is unclear for me, which further made it challenging to understand the consequences of the theorems presented in that section. Here is a big-picture question that I would like to know answer for. Do the results of sec 3 help us identify a more useful/computationally tractable model than exiting approaches? Clarification on this will help me evaluate the significance of the paper. I have three main clarification points. First, what is the importance of T1, T2, and T3 classes defined in Def. 7, i.e., why are these classes useful in solving some problems? Second, is the opposite relationship in Theorem 1, 2, and 3 true as well, e.g., is every linear combination of beta-ELBO and VMI is equivalent to a likelihood-based computable-objective of KL info-encoding family? Is the same true for other theorems? Third, the objective of section 3 is to show that ""only some choices of lambda lead to a dual with a tractable equivalent form"". Could you rewrite the theorems so that they truly reflect this, rather than stating something which only indirectly imply the main claim of the paper. Some small comments: - Eq. 4. It might help to define MI to remind readers. - After Eq. 7, please add a proof (may be in the Appendix). It is not that straightforward to see this. Also, I suppose you are saying Eq. 3 but with f from Eq. 4. - Line after Eq. 8, D_i is ""one"" of the following... Is it always the same D_i for all i or it could be different? Make this more clear to avoid confusion. - Last line in Para after Eq. 15, ""This neutrality corresponds to the observations made in.."" It might be useful to add a line explaining that particular ""observation"" - Def. 7, the names did not make much sense to me. You can add a line explaining why this name is chosen. - Def. 8, the last equation is unclear. Does the first equivalence impy the next one? - Writing in Sec. 3.3 can be improved. e.g., ""all linear operations on log prob."" is very unclear, ""stated computational constraints"" which constraints? "	2	4	0.0255474452554744	0.9785	"EDIT: I have read the authors rebuttals and other reviews. My opinion has not been changed. I recommend the authors significantly revise their work, streamlining the narrative and making clear what problems and solutions they solve. While I enjoy the perspective of unifying various paths, its unclear what insights come from a simple reorganization. For example, what new objectives come out? Or given this abstraction, what new perspectives or analysis is offered? --- The authors propose an objective whose Lagrangian dual admits a variety of modern objectives from variational auto-encoders and generative adversarial networks. They describe tradeoffs between flexibility and computation in this objective leading to different approaches. Unfortunately, Im not sure what specific contributions come out, and the paper seems to meander in derivations and remarks that I didnt understand what the point was. First, its not clear what this proposed generalization offers. Its a very nuanced and not insightful construction (eq. 3) and with a specific choice of a weighted sum of mutual informations subject to a combinatorial number of divergence measure constraints, each possibly held in expectation (eq. 5) to satisfy the chosen subclass of VAEs and GANs; and with or without likelihoods (eq. 7). What specific insights come from this that isnt possible without the proposed generalization? Its also not clear with many GAN algorithms that reasoning with their divergence measure in the limit of infinite capacity discriminators is even meaningful (e.g., Arora et al., 2017; Fedus et al., 2017). Its only true for consistent objectives such as MMD-GANs. Section 4 seems most pointed in explaining potential insights. However, it only introduces hyperparameters and possible combinatorial choices with no particular guidance in mind. For example, there are no experiments demonstrating the usefulness of this approach except for a toy mixture of Gaussians and binarized MNIST, explaining what is already known with the beta-VAE and infoGAN. It would be useful if the authors could make the paper overall more coherent and targeted to answer specific problems in the literature rather than try to encompass all of them. Misc + The ""feature marginal"" is also known as the aggregate posterior (Makhzani et al., 2015) and average encoding distribution (Hoffman and Johnson, 2016); also see Tomczak and Welling (2017)."	2	4	0.0432432432432432	0.9321	"Thank you for the feedback, I have read it. I do think that developing unifying frameworks is important. But not all unifying perspective is interesting; rather, a good unifying perspective should identify the behaviour of existing algorithms and inspire new algorithms. In this perspective, the proposed framework might be useful, but as noted in the original review, the presentation is not clear, and its not convincing to me that the MI framework is indeed useful in the sense I described above. I think probably the issue is the lack of good evaluation methods for generative models. Test-LL has no causal relationship to the quality of the generated data. So does MI. So I dont think the argument of preferring MI over MLE is convincing. So in summary, I will still keep my original score. I think the paper will be accepted by other venues if the presentation is improved and the advantage of the MI perspective is more explicitly demonstrated. ==== original review ==== Thank you for an interesting read. The paper presented a unifying framework for many existing generative modelling techniques, by first considering constrained optimisation problem of mutual information, then addressing the problem using Lagrange multipliers. I see the technical contribution to be the three theorems, in the sense that it gives a closure of all possible objective functions (if using the KL divergences). This can be useful: Im tired of reading papers which just add some extra ""regularisation terms"" and claim they work. I did not check every equation of the proof, but it seems correct to me. However, an imperfection is, the paper did not provide a convincing explanation on why their view should be preferred compared to the original papers intuition. For example in VAE case, why this mutual information view is better than the traditional view of approximate MLE, where q is known to be the approximate posterior? A better explanation on this (and similarly for say infoGAN/infoVAE) will significantly improve the paper. Continuing on the above point, why in section 4 you turn to discuss relationship between mutual information and test-LL? How does that relate to the main point you want to present in the paper, which is to prefer MI interpretation if I understand it correctly? Term usage: we usually *maximize* the ELBO and *minimise* the variational free-energy (VFE). "	3	4	0.0412371134020618	0.9895	2018
1	This paper presents an analysis of using multiple generators in a GAN setup, to address the mode-collapse problem. R1 was generally positive about the paper, raising the concern on how to choose the number of generators, and also whether parameter sharing was essential. The authors reported back on parameter sharing, showing its benefits yet did not have any principled method of selecting the number of generators. R2 was less positive about the paper, pointing out that mixture GANs and multiple generators have been tried before. They also raised concern with the (flawed) Inception score as the basis for comparison. R2 also pointed out that fixing the mixing proportions to uniform was an unrealistic assumption. The authors responded to these claims, clarifying the differences between this paper and the previous mixture GAN/multiple generator papers, and reporting FID scores. R3 was generally positive, also citing some novelty concerns similar to that of R2. I acknowledge the authors detailed responses to the reviews (in particular in response to R2) and I believe that the majority of concerns expressed have now been addressed. I also encourage the authors to include the FID scores in the final version of the paper.	"The present manuscript attempts to address the problem of mode collapse in GANs using a constrained mixture distribution for the generator, and an auxiliary classifier which predicts the source mixture component, plus a loss term which encourages diversity amongst components. All told the proposed method is quite incremental, as mixture GANs/multi-generators have been done before. The Inception scores are good but its widely known now that Inception scores are a deeply flawed measure, and presenting it as the only quantitative measure in a manuscript which makes strong claims about mode collapse unfortunately will not suffice. If the generator were to generate one template per class for which the Inception networks p(y|x) had low entropy, the Inception score would be quite high even though the model had only memorized one image per class. For claims surrounding mode collapse in particular, evaluation against a parameter count matched baseline using the AIS log likelihood estimation procedure in Wu et al (2017) would be the gold standard. Frechet Inception distance has also been proposed which at least has some favourable properties relative to Inception score. The mixing proportions are fixed to the uniform distribution, and therefore this method also makes the unrealistic assumption that modes are equiprobable and require an equal amount of modeling capacity. This seems quite dubious. Finally, their own qualitative results indicate that theyve simply moved the problem, with clear evidence of mode collapse in one of their mixture components in figure 5c, 4th row from the bottom. Indeed, this does nothing to address the problem of mode collapse in general, as there is nothing preventing individual mixture component GANs from collapsing. Uncited prior work includes Generative Adversarial Parallelization of Im et al (2016). Also, if Im not mistaken this is quite similar to an AC-GAN, where the classes are instead randomly assigned and the generator conditioning is done in a certain way; namely the first layer activations are the sum of K embeddings which are gated by the active mixture component. More discussion of this would be warranted. Other notes: - The introduction contains no discussion of the ill-posedness of the GAN game as it is played in practice. - ""As a result, the optimization order in 1 can be reversed"" this does not accurately characterize the source of the issues, see, e.g. Goodfellow (2015) ""On distinguishability criteria..."". - Section 3: the second last sentence of the third paragraph is vague and doesnt really say anything. Of course parameter sharing leverages common information. How does this help to train the model effectively? - Section 3: Since JSD is defined between two distributions, it is not clear what JSD_pi(P_G1, P_G2, ...) refers to. The last line of the proof of theorem 2 leaps to calling this term a Jensen-Shannon divergence but its not clear what the steps are; it looks like a regular KL divergence to me. - Section 3: Also, is the classifier being trained to maximize this divergence or just the generator? I assume the latter. - The proof of Theorem 3 makes unrealistic assumptions that we know the number of components a priori as well as their mixing proportions (pi). - ""... which further minimizes the objective value"" -- it minimizes a term that you introduced which is constant with respect to your learnable parameters. This is not a selling point, and Im not sure why you bothered mentioning it. - Theres no mention of the substitution of log (1 - D(x)) for -log(D(x)) and its effect on the interpretation as a Jensen-Shannon divergence (which Im not sure was quite right in the first place) - Section 4: does the DAE introduced in DFM really introduce that much of a computational burden? - ""Symmetric Kullback Liebler divergence"" is not a well-known measure. The standard KL is asymmetric. Please define it. - Figure 2 is illegible in grayscale. - Improved-GAN score in Table 1 is misleading, as this was their no-label baseline. Its fine to include it but indicate it as such. Update: many of my concerns were adequately addressed, however I still feel that calling this an avenue to ""overcome mode collapse"" is misleading. This seems aimed at improving coverage of the support of the data distribution; test log likelihood bounds via AIS (there are GAN baselines for MNIST in the Wu et al manuscript I mentioned) would have been more compelling quantitative evidence. Ive raised my score to a 5."	2	4	0.034106412005457006	0.4152	"Summary: The paper proposes a mixture of generators to train GANs. The generators used have tied weights except the first layer that maps the random codes is generator specific, hence no extra computational cost is added. Quality/clarity: The paper is well written and easy to follow. clarity: The appendix states how the weight tying is done , not the main paper, which might confuse the reader, would be better to state this weight tying that keeps the first layer free in the main text. Originality: Using multiple generators for GAN training has been proposed in many previous work that are cited in the paper, the difference in this paper is in weight tying between generators of the mixture, the first layer is kept free for each generator. General review: - when only the first layer is free between generators, I think it is not suitable to talk about multiple generators, but rather it is just a multimodal prior on the z, in this case z is a mixture of Gaussians with learned covariances (the weights of the first layer). This angle should be stressed in the paper, it is in fine, *one generator* with a multimodal learned prior on z! - Taking the multimodal z further , can you try adding a mean to be learned, together with the covariances also? see if this also helps? - in the tied weight case, in the synthetic example, can you show what each ""generator"" of the mixture learn? are they really learning modes of the data? - the theory is for general untied generators, can you comment on the tied case? I dont think the theory is any more valid, for this case, because again your implementation is one generator with a multimodal z prior. would be good to have some experiments and see how much we loose for example in term of inception scores, between tied and untied weights of generators. "	3	5	0.028037383177569996	0.9239	MGAN aims to overcome model collapsing problem by mixture generators. Compare to traditional GAN, there is a classifier added to minimax formulation. In training, MGAN is optimized towards minimizing the Jensen-Shannon Divergence between mixture distributions from generator and data distribution. The author also present that using MGAN to achive state-of-art results. The paper is easy to follow. Comment: 1. Seems there still no principle to choose correct number of generators but try different setting. Although most parameters of generators are shared, the result various. 2. Parameter sharing seems is a trick in MGAN model. Could you provide experiment results w/o parameter sharing. 	3	3	0.0194174757281553	0.882	2018
